{
  "$schema": "https://json-schema.org/draft/2020-12/schema",
  "$id": "https://inkyquill.net/pocket-editor/schemas/manifest-v1.schema.json",
  "title": "Pocket Editor book manifest v1",
  "type": "object",
  "additionalProperties": false,
  "required": [
    "book_id",
    "title"
  ],
  "properties": {
    "schema_version": {
      "const": 1,
      "default": 1
    },
    "book_id": {
      "$ref": "#/$defs/uuid"
    },
    "title": {
      "type": "string"
    },
    "chapters": {
      "type": "array",
      "default": [],
      "uniqueItems": true,
      "items": {
        "$ref": "#/$defs/chapter"
      }
    },
    "ignored_files": {
      "type": "array",
      "default": [],
      "uniqueItems": true,
      "items": {
        "$ref": "#/$defs/direct_child_path"
      }
    }
  },
  "$defs": {
    "uuid": {
      "type": "string",
      "pattern": "^[0-9a-fA-F]{8}-[0-9a-fA-F]{4}-[0-9a-fA-F]{4}-[0-9a-fA-F]{4}-[0-9a-fA-F]{12}$"
    },
    "direct_child_path": {
      "type": "string",
      "pattern": "^(?!\\.{1,2}$)[^/\\\\\\u0000]+$"
    },
    "chapter": {
      "type": "object",
      "additionalProperties": false,
      "required": [
        "id",
        "path",
        "title"
      ],
      "properties": {
        "id": {
          "$ref": "#/$defs/uuid"
        },
        "path": {
          "$ref": "#/$defs/direct_child_path"
        },
        "title": {
          "type": "string"
        }
      }
    }
  }
}
